,Job Title,Company,Location,Posting Date,Extract Date,Summary,Salary,Job Url,id
1074,Sr Treasury Manager,Amazon.com Services LLC,"New York, NY",30+ days ago,2021-03-23,"Experience with multi-lateral foreign exchange netting, in-house banking solutions, and pay-on/receive-on-behalf-of cash management solutions.",,https://www.indeed.com/rc/clk?jk=66a0f240307affc7&fccid=fe2d21eef233e94a&vjs=3,1074
1075,"Senior Audit Manager, Regional Audit",HSBC,"New York, NY",21 days ago,2021-03-23,"Manages the audit planning process to include completion of the audit risk assessment; manages on-site audit work to include staff work-paper review, conducting…",,https://www.indeed.com/rc/clk?jk=716e7a766814cbef&fccid=04c9b139c84ea1b5&vjs=3,1075
1076,Assurance Senior Manager,BDO,"New York, NY",5 days ago,2021-03-23,"Prior experience performing SAS70 highly desired.
Exposure to industry software such as PeopleSoft, JD Edwards, SAP, Lawson, Oracle Financials, Great Plains,…",,https://www.indeed.com/rc/clk?jk=c2364892c4a4d62d&fccid=3639654bd4055c70&vjs=3,1076
1077,Senior Accountant (21-23197),The Atlantic Group,"Iselin, NJ",30+ days ago,2021-03-23,"In this position, the ideal candidate will be responsible for :
Accounting & Reporting for properties, Acquisition Accounting, set-up accounting for properties…",,https://www.indeed.com/pagead/clk?mo=r&ad=-6NYlbfkN0Dg7u8ZfrO0QxuixjrrRDKqngCb5Kp_5ZJ-P4j3doy1U3-m7HZU8UhjPLVfT2DCTu2EGu-QPFWn34DtSp6aCBkso94w75pCJOg59MWCTYEUcXr13DTGpUxYbjtsf8LmmKt36TjbFfkrKMRRC2WiAYnh0bOjpuUSxCWRrl1u2wp_zGh-N28FUVlBHtraLU675VX19vV0F9yzA49o8H_ueM9LYbJ_T6duA75vYTFapUqdujA-BjZVy-LL9l5mIxLKCPgXUS2E-gccPM7VW0mVedmNId9cEtUjlKpHIl3rTi6C921ZaaAHYgCg86XBK-drCY2sH-ZbFD0pA5sZId_wKw4UkJsQX_shIZbNknhB9m1P6soUsJ3sD02MIQ5TqOnoXk4Sg4Y74QC58P2Y0D2EA6gLdzKsdl-srmxYdBNo2t0RXIYNHEmRISBjCslAkLkHrcKg8gR90qDA30aVgh2vf2wWUM0eee6M2O7nQfrKT8pvYQ==&p=6&fvj=1&vjs=3,1077
1078,"Analyst/Senior Analyst, Tax Data",Uber,"New York, NY",26 days ago,2021-03-23,"In Finance, we work hand-in-hand with leaders across the company to ensure smooth, disciplined execution of strategic business objectives.",,https://www.indeed.com/rc/clk?jk=0318b63fc19dac76&fccid=f766f8bfbc3effb7&vjs=3,1078
1079,"Financial Services Tax Regulated Investment Company (""RIC"") Senior",PRICE WATERHOUSE COOPERS,"New York, NY",30+ days ago,2021-03-23,"Use a broad range of tools and techniques to extract insights from current industry or sector trends.
You’ll advise clients on their local and overseas tax…",,https://www.indeed.com/rc/clk?jk=7af3a2f70c4f1a38&fccid=5e964c4afc56b180&vjs=3,1079
1080,Experienced Audit Senior,BDO,"New York, NY",13 days ago,2021-03-23,"The Experienced Audit Senior will be responsible for coordinating the day-to-day ""in-charge"" duties of planning, fieldwork and ""wrap-up"" to include the…",,https://www.indeed.com/rc/clk?jk=ffe3233e6beca042&fccid=3639654bd4055c70&vjs=3,1080
1081,Tax Reporting & Advisory Senior Associate,Grant Thornton,"New York, NY",30+ days ago,2021-03-23,"Run client engagements from start to finish, which includes planning, executing, directing, and completing tax projects and managing to budget.",,https://www.indeed.com/rc/clk?jk=783a92eace7777d1&fccid=7ac82fceed64aa81&vjs=3,1081
1082,Senior Accountant,The Execu|Search Group,"New York, NY",30+ days ago,2021-03-23,"Support supervisors in corporate, portfolio and internal firm projects as needed.
Audit experience with a public accounting firm.",,https://www.indeed.com/pagead/clk?mo=r&ad=-6NYlbfkN0B-PqtJkJBxcFK4No1YgA2WlSENonneqf7HjiGu_Q0_hPh9jaf6ReQGTX3lAwpnZhCcblDjnpc--fz_6mgo8BEnnDoKg87550_5Qz2wgIHFMUuJ6paJYlN-m4uMu2FhGHPzoEv64EAQ5_uQCiXnTCxnIzrAKaqc03sGg5SMaM6XewVaUWiPNOXmz6PJHw7YPCm0QJfY-7wVMLw02CsCxJfpC_T9WG2J8SRg_icWIbG4mu6_gr0uSY2h48O6OfZawRFbaX4swl_mmswDGQB9d10SCaRGB7d19TOO76lvl-nxmWI3yY4_cuxoFbWrDn5GX8m2Amr5xAcxAGntCq9q2tz8bxHfYnNGtWICTCrWazYqWRiFMR3Mj15Pz3r4QCQdxa1kMrAuv4rrDDtEiyOhMzGgEm3PRAnVJ3BvPGqKEhxcoynczWILnb3rvJope2iwp_5h21mLMC1OFWiNu0vBv0y0SUnbTlIoTdM=&p=11&fvj=0&vjs=3,1082
1083,Senior Auditor,American Express,"New York, NY",13 days ago,2021-03-23,"Assist team leaders, senior managers / managers, and senior auditors in accomplishing audit objectives in a team environment.
3+ years of relevant experience.",,https://www.indeed.com/rc/clk?jk=a2936f4ff2b1a5d3&fccid=f057e04c37cca134&vjs=3,1083
1084,Senior Property Financial Analyst/ Accountant,Vornado Realty Trust,"Paramus, NJ",12 days ago,2021-03-23,"Current accounting experience, preferably in the commercial real estate industry or in a medium or large CPA firm for 3 or more years.",,https://www.indeed.com/rc/clk?jk=48639de5d05d384f&fccid=ca4583d1c1ec45f9&vjs=3,1084
1085,"Senior Associate, Internal Audit (Asset Management)",KPMG,"New York, NY",18 days ago,2021-03-23,Identify and clearly communicate performance improvement opportunities and leading practices to client personnel and senior management and work with partners to…,,https://www.indeed.com/rc/clk?jk=6c933b476a1c3ab0&fccid=2dd390c3a48a7ed0&vjs=3,1085
1086,Assurance Senior Associate [Commercial Real Estate],CohnReznick,"New York, NY",30+ days ago,2021-03-23,"As a Senior Associate, you will serve as the engagement lead on specific client accounts, taking responsibility for pre-engagement planning, execution and final…",,https://www.indeed.com/rc/clk?jk=796b1a73cd6257b9&fccid=f0bade0760e83581&vjs=3,1086
1087,"Senior Audit Manager, Regional Audit",HSBC,"New York, NY",21 days ago,2021-03-23,"Manages the audit planning process to include completion of the audit risk assessment; manages on-site audit work to include staff work-paper review, conducting…",,https://www.indeed.com/rc/clk?jk=716e7a766814cbef&fccid=04c9b139c84ea1b5&vjs=3,1087
1088,Tax Senior,Friedman LLP,"New York, NY",30+ days ago,2021-03-23,"Participates in planning and execution of client engagement in collaboration with the Manager and/or Partner on the job.
Trains and mentors lower level staff.",,https://www.indeed.com/rc/clk?jk=f9ff0cdb37a89c9d&fccid=c902b575d624a64b&vjs=3,1088
1089,Senior Audit Associate,PKF O'Connor Davies,"New York, NY",30+ days ago,2021-03-23,"The Senior Audit Associate must be able to perform and direct the broadest range of accounting tasks and will assist the supervisor, manager and/or partner in…",,https://www.indeed.com/rc/clk?jk=c7763b4d18f2497a&fccid=39139820e001980d&vjs=3,1089
1090,Assurance Senior Manager,BDO,"New York, NY",5 days ago,2021-03-23,"Prior experience performing SAS70 highly desired.
Exposure to industry software such as PeopleSoft, JD Edwards, SAP, Lawson, Oracle Financials, Great Plains,…",,https://www.indeed.com/rc/clk?jk=c2364892c4a4d62d&fccid=3639654bd4055c70&vjs=3,1090
1091,Tax Senior,"Katz, Sapper & Miller (KSM)","New York, NY",30+ days ago,2021-03-23,"KSM will not pay a fee to recruiters or agencies that do not have a signed KSM vendor contract.
Participates in planning and scheduling client engagements.",,https://www.indeed.com/rc/clk?jk=15d6c56e5171f2ec&fccid=a4ee758555403fbb&vjs=3,1091
1092,Senior Consultant - R&C Internal Audit (NY),CrossCountry Consulting,"New York, NY",30+ days ago,2021-03-23,"3 years + professional services experience in a client facing role at a consulting firm, Big Four accounting firm, or commensurate experience in the industry…",,https://www.indeed.com/rc/clk?jk=752c9fe2edf0b2f1&fccid=41d4f951b1ea5f2a&vjs=3,1092
1093,Transfer Pricing Tax Senior Associate,BDO,"New York, NY",13 days ago,2021-03-23,"In this role, the STS Transfer Pricing Senior Associate will be charged with gathering client information for appropriate tax filings and preparing tax accrual…",,https://www.indeed.com/rc/clk?jk=56afe0d3327cd9a7&fccid=3639654bd4055c70&vjs=3,1093
1094,Senior Accountant,Vaco,"Paramus, NJ",Just posted,2021-03-23,"To be successful in this role, qualified candidates should have experience with project accounting, costing, and scheduling.
Month end/year end (6/30) overtime.",,https://www.indeed.com/pagead/clk?mo=r&ad=-6NYlbfkN0D_sybMACCpf9B-677oK5j6rPldVB6BlrVvFjO_o-GJZbzuF-qh4PxErFUqfUsv_6s7DMb5mhTYBm2NL5HdBj8PcLEx03QnQxqVBcLAffbo0UpGIbsjGNP4fuMEC22vCa0_QtI5AatLeQ1VAyRZ5EhXcFNLZZ08m8GFEhSkg3IROu9-kq3nYiu-iL2Oz8qz1WlIY7FnDYT1hCMTdz7-nnr1vyfyAxERU9h1_TfrfAq0Cp5F739nnMI3I8kmu8B6lqRZSkG39HmfpRF9XqHa3vk1pvhawJMYbC0EJIMWZfRonNs45WkDY5r8qA7QJyLko75oOtY6or5uQPa0MBkmfVCxMZpRrHPhRRoKxGSDwmBTegWkHst-dCmckfGuoKeU9L7Hx6UAOcjQ4J7hj7I7-8ptlHyO-OBuHallTUDmXMWjXfZF0u3ygBQv09ZDrnt-_GkAASMS3diEoVPtz18cSNY75D5Vk-zY4P-8dc4CnhI2kUd_0aL5VGkQYB4SswfyHWk=&p=8&fvj=0&vjs=3,1094
1095,Experienced Audit Senior,BDO,"New York, NY",13 days ago,2021-03-23,"The Experienced Audit Senior will be responsible for coordinating the day-to-day ""in-charge"" duties of planning, fieldwork and ""wrap-up"" to include the…",,https://www.indeed.com/rc/clk?jk=ffe3233e6beca042&fccid=3639654bd4055c70&vjs=3,1095
1096,Tax Reporting/Trust Specialist - Implementation Conversion Analyst Senior,FIS Global,"New York, NY",1 day ago,2021-03-23,"Acts as an on-site resource during conversion and answers questions, troubleshoots problems as they occur, supports implementation of new procedures, conducts…",,https://www.indeed.com/rc/clk?jk=9562affb3ddb6e30&fccid=74e36d81c894b4b7&vjs=3,1096
1097,State and Local Tax - Financial Services - Senior Associate - New York,PRICE WATERHOUSE COOPERS,"New York, NY",27 days ago,2021-03-23,"Use a broad range of tools and techniques to extract insights from current industry or sector trends.
You’ll help with assessing our client’s state and local…",,https://www.indeed.com/rc/clk?jk=16134deee0f221cb&fccid=5e964c4afc56b180&vjs=3,1097
1098,Tax Senior Associate - NFP [Not-For-Profit ],CohnReznick,"New York, NY",30+ days ago,2021-03-23,"A flexible work environment with competitive benefits.
The ideal candidate will have tax and/or audit experience with Not-for-Profit entities, including the…",,https://www.indeed.com/rc/clk?jk=214fb1015b4581c9&fccid=f0bade0760e83581&vjs=3,1098
1099,Tax Senior/ Manager,Cerity Partners,"New York, NY",30+ days ago,2021-03-23,"Extensive knowledge of income tax planning and financial planning.
5 – 10 years of HNW tax experience with CPA firm or wealth management firm.",,https://www.indeed.com/rc/clk?jk=fd2d1123d8572c03&fccid=7c93ce0724bf2cd8&vjs=3,1099
1100,"Senior Specialist, SOX Compliance & Control",BNY Mellon,"New York, NY",17 days ago,2021-03-23,"Contributes in the execution of the SOX assessment program in providing thorough and reliable identification of in-scope accounts and locations, planning,…",,https://www.indeed.com/rc/clk?jk=15085f8d43454ad7&fccid=b4048be2884af072&vjs=3,1100
1101,Tax Senior Associate - PCS [Private Client Services Group],CohnReznick,"New York, NY",30+ days ago,2021-03-23,"2-4 years' experience in a large or mid-size public accounting firm.
A flexible work environment with competitive benefits.
Must have strong analytical skills.",,https://www.indeed.com/rc/clk?jk=bdf1eb1b7ca3b0fa&fccid=f0bade0760e83581&vjs=3,1101
1102,Senior Internal Auditor - Reinsurance,Arch Capital Services LLC,"New York, NY",21 days ago,2021-03-23,"May lead certain aspects of Audit/Advisory projects including engagement planning, depending upon skillsets and project requirements.",,https://www.indeed.com/rc/clk?jk=4af5885d54975fd2&fccid=1765e22da8e26881&vjs=3,1102
1103,Sr. Tax Accountant,Cognyte,"Melville, NY",22 days ago,2021-03-23,"O 5+ years of experience with a mid-size or Big 4 public accounting firm or in a large corporate tax department focused on federal and state tax compliance,…",,https://www.indeed.com/rc/clk?jk=b948c0e238bea0b2&fccid=090ca10780e75fdb&vjs=3,1103
1104,Senior Manager - Fund Controller,Sanne group,"New York, NY",30+ days ago,2021-03-23,"Prepare fund financial statements with footnotes and supporting schedules;
Prepare work paper files including investment activity, management fee calculations,…",,https://www.indeed.com/rc/clk?jk=988da6c0cdeab922&fccid=bc53a78caa35cae7&vjs=3,1104
1105,Sr Auditor / Staff Auditor,CEDENT,"New York, NY",30+ days ago,2021-03-23,"At least 2 years of experience, preferably a mix of time in a Big 4 public accounting firm (or reputable accounting firm) and a large international audit ,…",,https://www.indeed.com/rc/clk?jk=c1378f37622f1188&fccid=2ecf4575019bf07a&vjs=3,1105
1106,"Senior Tax Accountant, Sales & Use Tax",Securitas USA - Corporate Services,"Parsippany, NJ",Active 20 days ago,2021-03-23,"Excellent planning, organization and time management skills.
Reporting to the Sales Tax Manager, this position will be responsible for the preparation of sales…",,https://www.indeed.com/company/Securitas/jobs/Senior-Tax-Accountant-bce6099f7a8c4aeb?fccid=842ec1ced0fea1d5&vjs=3,1106
1107,"Alternative Investments Accountant, Senior - Hackensack, NJ",U.S. Bank,"Hackensack, NJ",27 days ago,2021-03-23,"Records trade information, income/expense activity and applies valuation of securities in the portfolio accounting system.",,https://www.indeed.com/rc/clk?jk=a5c903a23a41b804&fccid=ae5bfc395c530fbc&vjs=3,1107
1108,Senior Revenue Accounting Manager,Sprinklr,"New York, NY",30+ days ago,2021-03-23,"We empower entire organizations to work together – across marketing, advertising, research, commerce, and customer care – to manage customer experience at scale…",,https://www.indeed.com/rc/clk?jk=2cb0adcd787f05fb&fccid=4fd082a45bed2681&vjs=3,1108
1109,(Senior) Audit Associate - Operational and Financial Assurance,Siemens,"Iselin, NJ",30+ days ago,2021-03-23,"Controlling and Finance Assurance (CF A) helps Siemens achieve its goals by providing objective, factual and independent assurance to the Siemens Managing Board…",,https://www.indeed.com/rc/clk?jk=02ae7f383657c7d8&fccid=3b89b9ec324f96c8&vjs=3,1109
1110,Senior Audit Manager - Risk Governance,Citi,"New York, NY",22 days ago,2021-03-23,"The Risk Governance organization is responsible for activities ranging from firm-wide frameworks, processes and practices that are integral and fundamental to…",,https://www.indeed.com/rc/clk?jk=c12546b3d5c2e362&fccid=5bcd1ef0a7f4fb99&vjs=3,1110
1111,"Senior Risk Consultant, Internal Audit",Mazars USA,"New York, NY",30+ days ago,2021-03-23,"Understands engagement and project planning.
Contributes to work planning and status reporting on assigned engagements.
Business Development, and Firm Growth.",,https://www.indeed.com/rc/clk?jk=58701471414ffd8e&fccid=cf80abde47d3bd81&vjs=3,1111
1112,Senior Accountant - Tax,Buckno Lisicky & Company,"Cedar Knolls, NJ",30+ days ago,2021-03-23,"Preparation of corporate and individual tax returns.
Research and handle assignments involving tax theory and concepts.
Handle client calls and requests.",,https://www.indeed.com/rc/clk?jk=5dfb9d62faeb6443&fccid=c1996dbf7e3d1103&vjs=3,1112
1113,Sr. Accountant,Tapestry,"North Bergen, NJ",5 days ago,2021-03-23,"Managerial Courage: Doesn’t hold back anything that needs to be said; provides current, direct, complete, and “actionable” positive and corrective feedback to…",,https://www.indeed.com/rc/clk?jk=a5105cff1f0d62be&fccid=4b0e713ef50478fa&vjs=3,1113
1114,Senior Accountant (3-5 years’ experience),Traphagen CPAs & Wealth Advisors,"Oradell, NJ",25 days ago,2021-03-23,"Identify and execute tax planning opportunities.
Bachelor's degree in Accounting, Master's degree a plus • Minimum 3 - 5 years of public accounting experience •…",,https://www.indeed.com/rc/clk?jk=4e6bc661f29d01c9&fccid=d25de26f57b9bbc0&vjs=3,1114
1115,"Financial Accounting Advisory Services, Senior Manager",Accordion Partners,"New York, NY",20 days ago,2021-03-23,"Act as the firm representative during client engagements.
Assist in growing the firm by supporting business development activities.",,https://www.indeed.com/rc/clk?jk=1c6f4885d89f209d&fccid=5b2a641dc6b8f5cc&vjs=3,1115
1116,Sr. Accountant,Landing Point Search Group,"Rockland County, NY",30+ days ago,2021-03-23,"Processing payroll & commission for the firm’s brokers.
Managing the full accounts payable process.
Managing the full accounts receivable process.",,https://www.indeed.com/pagead/clk?mo=r&ad=-6NYlbfkN0A9cB7QBOOnzobjLFYmZtpS_pcA0Pg25JZkCWjVY8aiW5h2LFngxJc07vVm6RkZ35xipq10NtbkI_3Z4EtFNqtlUBjaWfjxcdjPP1IW-uoohGJQ-wLpJYo3aY9hCoAdaLMA_aK91LpTJFy5CTrsLNK57z8jD_qZGol2A1Tuw1zpCuHD18sG-rzCKsgb9s0tJVWY6mJ_DJinjDtzetHrogrUD3BhjjH3AeQC5bT0vnNH2TawSC3Ghjk5JlNFYxQu6JLUJKmJvC6FbbD2KTF5A0bYd5z8OSm5SjkgWmbwGqyzyngsdVBaYXPpjyemAeX4dGn4FVr2UM5Ydb7QBof765WqyGhdIcOwQS_8_5wEUKyeULB_ZmaEf7ARmP6_O1MyeEqnEfzRn_yJ9R2CW4E91JHKCxK7guu9PY94TS0JgpuTzuuCs9cy3eE21EudiyGukuM6adS8lkn2IEJJ4HfrrCxy&p=0&fvj=1&vjs=3,1116
1117,"Senior Associate, Internal Audit (Asset Management)",KPMG,"New York, NY",18 days ago,2021-03-23,Identify and clearly communicate performance improvement opportunities and leading practices to client personnel and senior management and work with partners to…,,https://www.indeed.com/rc/clk?jk=6c933b476a1c3ab0&fccid=2dd390c3a48a7ed0&vjs=3,1117
1118,Tax Senior/ Manager,Cerity Partners,"New York, NY",30+ days ago,2021-03-23,"Extensive knowledge of income tax planning and financial planning.
5 – 10 years of HNW tax experience with CPA firm or wealth management firm.",,https://www.indeed.com/rc/clk?jk=fd2d1123d8572c03&fccid=7c93ce0724bf2cd8&vjs=3,1118
1119,"Senior Associate, Transfer Pricing",KPMG,"New York, NY",6 days ago,2021-03-23,"KPMG LLP (the U.S. member firm of KPMG International) offers a comprehensive compensation and benefits package.
Assist in delivering transfer pricing projects.",,https://www.indeed.com/rc/clk?jk=f1dcc322fffbe910&fccid=2dd390c3a48a7ed0&vjs=3,1119
1120,Audit Senior Associate- Financial Services,"Baker Tilly US, LLP","New York, NY",30+ days ago,2021-03-23,Learn and grow from direct on the job coaching and mentoring along with participating in firm wide learning and development programs.,,https://www.indeed.com/rc/clk?jk=d9a84acfc43f3947&fccid=1bfec2a2f61dd5c2&vjs=3,1120
1121,Senior Auditor Corporate Audit (Data Analytics),JetBlue Airways Corporation,"Long Island City, NY",27 days ago,2021-03-23,"Prepares and finalizes planning and announcement memos, assists in determining audit scope, and prepares and executes audit programs.",,https://www.indeed.com/rc/clk?jk=d20fe65d486b9764&fccid=38b8f999774b46b1&vjs=3,1121
1122,Senior Accountant,Staffing 360 Solutions,"New York, NY",30+ days ago,2021-03-23,"Prepare schedules use for SEC filings using Form 10-K/Qs.
The Senior Accountant will play a vital role on the Staffing 360 Solutions Finance team through…",,https://www.indeed.com/pagead/clk?mo=r&ad=-6NYlbfkN0D2oPcu62nCOEusvX-PkQ72CJmgvRX8N0x0rMs1pP2toU8TColOzD96WcJGW4YrKJhTTL5lZ9DcbV-nP08bt81k-O3YNh_JJCoXvyKYyiCw7gWj3Hkf5YLXs9IzBww9lz3c6hbyuz6PPOeNPeBXNvBQNyKsPUf740oewC_5nsqdZ_P84tj3KylgGaOJuxCkT6an7niJEesQkTHsvmoQCSR0My7qYt9P5wCZzc34oC80k3ZhIZjPcSR7BNjjcU_Rf2rfhOAvB_pMj3eNiHS2f_yyn6XnjaDftBjsm-1J0dGaVT3i5WyLWkNxr03LwagUdaAZagyn6f2Q2WrSq_I6ou3gt4V7DfftTuNIvT-l8SGX-XhHoXuEB-5rkeXu_IyhTm4o-7z2lGwLHQEQq_ODMglGhW6CduXXTUzMfFRjb3YmthPBJm3j8dpVMtAvA6TjFA5fDSXDEO-6CA==&p=6&fvj=1&vjs=3,1122
1123,"Senior Tax Manager, GSF Finance",Standard Chartered,"New York, NY",30+ days ago,2021-03-23,"Calculation/review of deferred tax asset schedules and quarterly/annual provision entries for the Group.
Serve a senior tax accounting role overseeing US tax…",,https://www.indeed.com/rc/clk?jk=e43819cb57dc4bee&fccid=5249cd8e17163cb5&vjs=3,1123
1124,Strategy & Transactions- Divestiture Advisory Services-NYC Senior,Ernst & Young,"New York, NY",7 days ago,2021-03-23,"You'll be working with and supporting the various team members including senior managers and partners.
A proven record of excellence in audit and/or mergers or…",,https://www.indeed.com/rc/clk?jk=f7efd0587c1a1997&fccid=1544766d4c2915b0&vjs=3,1124
1125,"Tax Senior, Private Client Services",Mazars USA,"New York, NY",30+ days ago,2021-03-23,"3-5 years of relevant experience working in a CPA firm, a professional services firm, a tax consulting practice or family office.",,https://www.indeed.com/rc/clk?jk=f8e9788e45f4c192&fccid=cf80abde47d3bd81&vjs=3,1125
1126,Sr Treasury Manager,Amazon.com Services LLC,"New York, NY",30+ days ago,2021-03-23,"Experience with multi-lateral foreign exchange netting, in-house banking solutions, and pay-on/receive-on-behalf-of cash management solutions.",,https://www.indeed.com/rc/clk?jk=66a0f240307affc7&fccid=fe2d21eef233e94a&vjs=3,1126
1127,Senior Auditor - Corporates,Société Générale,"New York, NY",30+ days ago,2021-03-23,"The Senior Auditor - Vice President will be part of the Corporate Team which is responsible for auditing corporate functions (Compliance, Finance, Human…",,https://www.indeed.com/rc/clk?jk=7f67874ba278e883&fccid=df6948c9b8da6236&vjs=3,1127
1128,Audit Analytics Senior - Data Analytics Support Specialist,Deloitte,"New York, NY",6 days ago,2021-03-23,"You will be part of a team working closely with senior leadership.
At Deloitte, we provide teams with a way to innovate their audit delivery to achieve greater…",,https://www.indeed.com/rc/clk?jk=2af65b956e006cfb&fccid=9e215d88a6b33622&vjs=3,1128
1129,Tax Senior,BDO,"New York, NY",30+ days ago,2021-03-23,"A Core Tax Services Senior Associate is responsible for utilizing research skills, applying tax foundational knowledge to understand potential tax issues,…",,https://www.indeed.com/rc/clk?jk=efae7211a710a9b1&fccid=3639654bd4055c70&vjs=3,1129
1130,Senior Inventory Cost Analyst,The RealReal,"Perth Amboy, NJ",30+ days ago,2021-03-23,"This is a unique opportunity for a professional with a demonstrated background to own, support and build this function to growth and scale.",,https://www.indeed.com/rc/clk?jk=cc72617277bb3d82&fccid=1b0692814cc13474&vjs=3,1130
1131,Senior Fund Accountant OR Assistant Controller,Large Hedge and Private Equity Fund,"New York, NY",30+ days ago,2021-03-23,"Review the portfolio companies to be acquired acquiring.
Records the journal entries for management fees, investments, accruals, other expense/income, valuation…",,https://www.indeed.com/pagead/clk?mo=r&ad=-6NYlbfkN0B2fBwIYhLX4r0C6A88f364H1rwUTQ-tkZvyqI1v8WDLLnX39X6BpFNT0US53ROuDgXNGi-Z4K_VMR7oInGMsP9GBSdNmsnUejpflM4HUkguvuNwFGafF3IVxRuVJTkgFiAOpcQ5xK2ThcoIXUsRscoscnX3lGW75IEDsH3V18E-KP_sFChtw6M5MgbYzZKOkpa55MvYXbl4fR8t0z28OhLVnrGBaUQ3f9a0Z3Zchu1gJQUSETDSIR6-xxQh5erVGdIkN95oStE27iIeamBfhLVwhNqhL0mrWkDcvMhnDwBp4FuBJbhb5PCvOoI7wWJK5cGD3cQppvtc0Vu9N5LeaWMCe3NfMYa6roMvbZltGaHjmFCYKvjY9Ovs2Ad2q5R5Mgv4PBB3d-6p1qCJzaf3C0Bt1ifqLFp4HflUCHQxqmRTUcpWjWSD8MC7Ovi8ZjvidgjVhkh4424WSlMU4MQjOhbPiod573rLraNbNaz4_x4fNVFi9M-PvC--zHdHbXWXdw=&p=0&fvj=1&vjs=3,1131
1132,Senior Property Accountant,Real Estate - NYC,"New York, NY",7 days ago,2021-03-23,"Prepare additional reports and analysis as required by senior management.
Maintain reconciling schedules to the general ledger, including accounts receivable ,…",,https://www.indeed.com/pagead/clk?mo=r&ad=-6NYlbfkN0DKPwmsixA66_4TNG-oiAnKeNu-ZkjPqG88q5kEWHW3fCAPfJnuhgXvfjwa8UoyuuvvD6QVF7gIREt5mdWt9cBdYAduHhP3wnXgRk6DM0BSajMtSgV27t3EfA_6WQzCNzfF5KadRPEvHqE9B8udc0MJAUbcKkISSfhYAJvnITAN5-srDNBund0cAhcHQpea57NV3fYRETmNTmIKPkz8P2V417KOP3aCRCCz_aFzq6dX_H_gI_7Pb8aiKq8QD-32-qn-8dt2FSzNrhhimVf5KdgYKXp2yg2DjWkA2LV81bqeD_ocB42Mi5g5GZiyeaBK5wOayffRK2KLlE0fubPkQk4LbiaClMfXhZpTDqjU8_4ZyXnuIcnHt7nefuEF7HM356PKnqObU8vVrQ-1MoIwo5HAjXvE9zF1nVy2-1g5tNZoUPZSTrpV5uqMkZIuysqyWeJ-DW3jRjfxF2xkvLTla7BbaD5FBxxKm48=&p=1&fvj=1&vjs=3,1132
1133,Senior Accountant,Juice Generation,"New York, NY",12 days ago,2021-03-23,"Lead monthly financial reviews with senior operations team.
Assist in the annual review process with external firm.
Bachelor’s degree in Accounting.",,https://www.indeed.com/pagead/clk?mo=r&ad=-6NYlbfkN0Bi-5CQquOZTqmyEimDJBNcBWnpgMujUg8xT5LcFJhBGBe3WQpTBLr6DfxWqLWhBjtfIDhNQHFXaWI0on-fRcjx7MbNuXpuzGHeSn7JpuGylbWbszEJ9-T2TzpijP6zegbuihU7r54rmumrlZwxbEcME3aRWf4xs7JE4qfmfArnjYiGwWAXCdmkt9IQyYAolA4sW6LP924vFZTnfjg0eG5oTfbuuLuGqT04pXI1_Z0O6fZo7mWQLOBw43PILCmpbFG3HRwrZThgEYPpze4b7io3ZxQ5KhHsko5EbjwvepOumg5Ynzu9dmKQupyakMYRd4bfVk69dChS7EuHbz-9IDcXtVaFij-vnbMAaLQ6VqIci4-AnOOjhZuJBQS8rCEalRnq9o7R75ACbU-kSCwMs198jl2Vge7U7HaufFb50HWumvrK4p1nZb2XIrZGy6uRNRedrVRNLNnisFdQYKMEDqHb&p=2&fvj=1&vjs=3,1133
1134,Senior Tax Manager,George Dimov CPA,"New York, NY",30+ days ago,2021-03-23,"-Experience with foreign entity reporting, 5471, FBARs, etc.
-CPA, EA, or degree in accounting.
-Accounting for RSUs, ESPP, or equity compensation on individual…",,https://www.indeed.com/pagead/clk?mo=r&ad=-6NYlbfkN0BkHtNCVSJHZG6C_NNDpRu26FC4yeFUJXxI0D3rI-UoaZv-hdZxxaXBr7GJbB7GjJhsin_HiefIsJh7m8dxKmTsMpAyBOrddtiWgx9vOSFYNp-Vt8joAALcito3KiW0_g-FzhizXOFDE76Q6cwY5RQUz4uWgdjd7RzM2Udklu6TLmqho5d6wW-paHbaSwa2OkUGoR6GkKQvlETIyMzTUsIHMRcp_NVxEZzdy_BWarJupoNmGRk7d2HIEKo83wIIvl8idse8379pZ9I1VDtb5ESkX3mt-HKwGX59GonpmNZ15h39rwoGifK53YGezeGmEfZ_-AmRMmy9rCmgHnzxRsNRk0fiAhcdU3bid2Nb3i6JBc_diOPbNQftH7yZtOPR6BWSN6aWemxRvfgHjkpH5_RM23OglEDKj8sv5Dv98AX4S9UgPZ2opN7Jx-dM0VVIIq24eDqmF2xYBs-ZxPDdl7Ft&p=3&fvj=1&vjs=3,1134
1135,Senior Accountant,Quality Branded,"New York, NY",30+ days ago,2021-03-23,"Prepare sales tax and commercial rent tax schedules and file tax payments monthly and quarterly.
Perform the reconciliation of bank accounts and credit card…",,https://www.indeed.com/pagead/clk?mo=r&ad=-6NYlbfkN0D99gI1XJg_GMoUcn54cXo4g5bXz-pkVE046ORhrmNjwDnnCWDys6Lu4eiQgNXPyhjDhihmTlDOtcCxWfzbq4Ik3EEO9sE88MPNZuiB1xkPipE6htOv07I3yiWWcr_yY68_0KWDsvn9_u57KTSghKFK7o4nx1k8TcE_RhypoXXZC0JzD5MDclfQ94ZX31884zKcfMnU2iJ_wzQIXtfG1YDS2-8LRAR6kfvFmevC8wzhlGolvPp2G3xdLH7kD64vqMhOzHzibvcQe63SRH2WyU1wTVpelZ7oG7Okk7vXlkUTK7HKbE212niIsEmnbsYd3H7NaVdz4AzpI63Um6hRo4WuQLe-JtKu5uY44ebvRc9hsxNfDAGKl3i9g62l27lhaKqbH2H9stYmFGiMliEYUFOHynNafxkeuBkep-p0ebHgaJlCqvv8X0VOTgGtigGeIZAg4hm7avNPp_FjrPa1zyRP&p=4&fvj=1&vjs=3,1135
